{
  "deploymentId": "deploy-001",
  "providerId": "ugv-prod-001",
  "environment": "production",
  "desiredState": "running",
  "desiredReplicas": 1,
  "runtimeVersion": "2.0.0-rc.1",
  "databaseProfileId": "db-profile-001",
  "configProfileId": "production:runtime_deployment:deploy-001:runtime:runtime-main",
  "adapterEndpoint": "127.0.0.1:8101",
  "status": "ACTIVE",
  "desiredRevision": 2,
  "observedRevision": 2
}
